{
  "contract": "ocr-resource-description",
  "version": "0.1.0",
  "backend": "rapidocr",
  "backend_version": "3.10.0",
  "files": {
    "config.yaml": "06623941e188461a0bc263fe16175cb5e5f6f6b01f4387e546d3a741569fc021",
    "default_models.yaml": "90e0159dead16c21adbf000014a46043c981ae097f041d92d8b19a52c2f2ed9a"
  },
  "models": [
    {
      "role": "det",
      "filename": "PP-OCRv6_det_small.onnx",
      "bytes": 9929594,
      "sha256": "090f04abcd9d9a7498bc4ebf677e4cb9bdce1fe4197ddb7e529f1ef44e1ff94f"
    },
    {
      "role": "cls",
      "filename": "ch_ppocr_mobile_v2.0_cls_mobile.onnx",
      "bytes": 585532,
      "sha256": "e47acedf663230f8863ff1ab0e64dd2d82b838fceb5957146dab185a89d6215c"
    },
    {
      "role": "rec",
      "filename": "PP-OCRv6_rec_small.onnx",
      "bytes": 21234383,
      "sha256": "6f327246b50388f3c176ae304bd95767ea6dc0c9ae92153ef8cbe210b3c14884"
    }
  ]
}
